{
  "claims": [
    {
      "category": "structure",
      "confidence": "direct",
      "derivation": "",
      "evidence": [
        {
          "end_line": 685,
          "file": "samples/hy_v3.py",
          "reason": "Wrapper constructs model, LM head and logits processor.",
          "start_line": 660,
          "symbol": "self.model"
        },
        {
          "end_line": 496,
          "file": "samples/hy_v3.py",
          "reason": "Model constructs embedding, decoder layers and final norm.",
          "start_line": 437,
          "symbol": "make_layers"
        }
      ],
      "external_boundary": "",
      "id": "claim:model-composition",
      "phase": "construction",
      "source_item_ids": [
        "method:HYV3ForCausalLM.__init__:660",
        "method:HYV3Model.__init__:437"
      ],
      "statement": "HYV3ForCausalLM owns HYV3Model, LM head and LogitsProcessor; HYV3Model owns embeddings, decoder layers and final norm.",
      "used_in_pages": [
        "model-architecture-and-execution"
      ]
    },
    {
      "category": "runtime",
      "confidence": "direct",
      "derivation": "",
      "evidence": [
        {
          "end_line": 561,
          "file": "samples/hy_v3.py",
          "reason": "Forward implements PP rank branches and final hidden-state production.",
          "start_line": 529,
          "symbol": "get_pp_group"
        }
      ],
      "external_boundary": "",
      "id": "claim:model-runtime-pipeline",
      "phase": "runtime",
      "source_item_ids": [
        "method:HYV3Model.forward:529",
        "branch:HYV3Model.forward:536:1",
        "branch:HYV3Model.forward:551:3"
      ],
      "statement": "Model forward separates first/non-first rank input handling, iterates the local decoder slice, returns IntermediateTensors on non-last ranks and finalizes add+norm on last rank.",
      "used_in_pages": [
        "model-architecture-and-execution"
      ]
    },
    {
      "category": "runtime",
      "confidence": "direct",
      "derivation": "",
      "evidence": [
        {
          "end_line": 708,
          "file": "samples/hy_v3.py",
          "reason": "Wrapper compute_logits calls LogitsProcessor with lm_head and hidden_states.",
          "start_line": 703,
          "symbol": "logits_processor"
        }
      ],
      "external_boundary": "",
      "id": "claim:compute-logits",
      "phase": "runtime",
      "source_item_ids": [
        "method:HYV3ForCausalLM.compute_logits:703"
      ],
      "statement": "compute_logits combines ParallelLMHead and hidden states through LogitsProcessor to produce logits.",
      "used_in_pages": [
        "model-architecture-and-execution"
      ]
    },
    {
      "category": "capability",
      "confidence": "derived",
      "derivation": "Class decorators and inherited interfaces combine into capability markers; they are displayed as badges rather than tensor flow.",
      "evidence": [
        {
          "end_line": 436,
          "file": "samples/hy_v3.py",
          "reason": "Decorator marks HYV3Model for torch compile support.",
          "start_line": 435,
          "symbol": "support_torch_compile"
        },
        {
          "end_line": 654,
          "file": "samples/hy_v3.py",
          "reason": "Wrapper inherits SupportsPP and SupportsLoRA.",
          "start_line": 654,
          "symbol": "SupportsLoRA"
        },
        {
          "end_line": 436,
          "file": "samples/hy_v3.py",
          "reason": "Base model inherits MixtureOfExperts.",
          "start_line": 436,
          "symbol": "MixtureOfExperts"
        }
      ],
      "external_boundary": "",
      "id": "claim:adapter-capabilities",
      "phase": "capability",
      "source_item_ids": [
        "class:HYV3ForCausalLM:654",
        "class:HYV3Model:436",
        "capability:pipeline_parallel",
        "capability:lora",
        "capability:torch_compile",
        "capability:moe"
      ],
      "statement": "The wrapper exposes PP and LoRA capabilities while the base model is marked torch-compile capable and implements MoE interfaces.",
      "used_in_pages": [
        "model-architecture-and-execution",
        "parallelism-configuration-and-weight-loading"
      ]
    },
    {
      "category": "runtime",
      "confidence": "direct",
      "derivation": "",
      "evidence": [
        {
          "end_line": 432,
          "file": "samples/hy_v3.py",
          "reason": "Decoder forward contains residual initialization and RMSNorm calls.",
          "start_line": 410,
          "symbol": "residual is None"
        }
      ],
      "external_boundary": "",
      "id": "claim:decoder-residual-lanes",
      "phase": "runtime",
      "source_item_ids": [
        "method:HYV3DecoderLayer.forward:410",
        "branch:HYV3DecoderLayer.forward:417:1"
      ],
      "statement": "Decoder forward keeps hidden-state and residual lanes separate, initializes residual from hidden states when residual is None, and uses fused RMSNorm handoffs.",
      "used_in_pages": [
        "decoder-and-attention"
      ]
    },
    {
      "category": "construction",
      "confidence": "direct",
      "derivation": "",
      "evidence": [
        {
          "end_line": 408,
          "file": "samples/hy_v3.py",
          "reason": "Decoder __init__ chooses HYV3FeedForward or HYV3MoEFused based on layer index.",
          "start_line": 367,
          "symbol": "first_k_dense_replace"
        }
      ],
      "external_boundary": "",
      "id": "claim:ffn-construction-variant",
      "phase": "construction",
      "source_item_ids": [
        "method:HYV3DecoderLayer.__init__:367",
        "branch:HYV3DecoderLayer.__init__:395:2"
      ],
      "statement": "Decoder construction chooses exactly one FFN implementation per layer: Dense FFN for first_k_dense_replace layers and HYV3MoEFused for remaining layers.",
      "used_in_pages": [
        "decoder-and-attention"
      ]
    },
    {
      "category": "runtime",
      "confidence": "direct",
      "derivation": "",
      "evidence": [
        {
          "end_line": 117,
          "file": "samples/hy_v3.py",
          "reason": "Dense FFN constructs gate_up/down projections and activation.",
          "start_line": 87,
          "symbol": "MergedColumnParallelLinear"
        },
        {
          "end_line": 123,
          "file": "samples/hy_v3.py",
          "reason": "Dense FFN forward applies gate_up, activation and down projection.",
          "start_line": 119,
          "symbol": "self.gate_up_proj"
        }
      ],
      "external_boundary": "",
      "id": "claim:dense-ffn-flow",
      "phase": "runtime",
      "source_item_ids": [
        "method:HYV3FeedForward.__init__:87",
        "method:HYV3FeedForward.forward:119"
      ],
      "statement": "Dense HYV3FeedForward uses MergedColumnParallelLinear gate_up_proj, SiluAndMul and RowParallelLinear down_proj.",
      "used_in_pages": [
        "decoder-and-attention"
      ]
    },
    {
      "category": "construction",
      "confidence": "direct",
      "derivation": "",
      "evidence": [
        {
          "end_line": 329,
          "file": "samples/hy_v3.py",
          "reason": "Attention __init__ constructs projections and decides HpcRopeNorm support.",
          "start_line": 225,
          "symbol": "QKVParallelLinear"
        }
      ],
      "external_boundary": "",
      "id": "claim:attention-construction",
      "phase": "construction",
      "source_item_ids": [
        "method:HYV3Attention.__init__:225",
        "branch:HYV3Attention.__init__:313:4"
      ],
      "statement": "Attention construction partitions heads for tensor parallelism, constructs QKVParallelLinear, RowParallelLinear, RoPE, optional Q/K RMSNorm, vLLM Attention and optional HpcRopeNorm support.",
      "used_in_pages": [
        "decoder-and-attention"
      ]
    },
    {
      "category": "runtime",
      "confidence": "direct",
      "derivation": "",
      "evidence": [
        {
          "end_line": 363,
          "file": "samples/hy_v3.py",
          "reason": "Attention forward shows qkv projection, split, HPC path and fallback path.",
          "start_line": 331,
          "symbol": "qkv"
        }
      ],
      "external_boundary": "",
      "id": "claim:attention-forward-paths",
      "phase": "runtime",
      "source_item_ids": [
        "method:HYV3Attention.forward:331",
        "branch:HYV3Attention.forward:339:1",
        "branch:HYV3Attention.forward:347:2"
      ],
      "statement": "Attention forward projects hidden states to qkv, splits q/k/v, sends the whole qkv tensor to HpcRopeNorm when configured, and otherwise applies optional Q/K RMSNorm then RoPE while V bypasses Q/K Norm.",
      "used_in_pages": [
        "decoder-and-attention"
      ]
    },
    {
      "category": "external",
      "confidence": "external",
      "derivation": "",
      "evidence": [
        {
          "end_line": 361,
          "file": "samples/hy_v3.py",
          "reason": "Local code delegates to imported Attention after local q/k/v preparation.",
          "start_line": 339,
          "symbol": "self.attn"
        }
      ],
      "external_boundary": "Attention is imported from vLLM; the local file proves delegation and arguments but not backend internals or KV cache read behavior.",
      "id": "claim:attention-external-backend",
      "phase": "external",
      "source_item_ids": [
        "method:HYV3Attention.forward:331",
        "capability:custom_attention"
      ],
      "statement": "vLLM Attention consumes the prepared q/k/v tensors; KV cache read and attention backend internals are external to this model file.",
      "used_in_pages": [
        "decoder-and-attention"
      ]
    },
    {
      "category": "construction",
      "confidence": "direct",
      "derivation": "",
      "evidence": [
        {
          "end_line": 205,
          "file": "samples/hy_v3.py",